Medium,Fabric,Technique,Form,Sub-form,Dates,Painter,Potter,Subject Additional,Location (Country),Location (City),Location (Collection),Collection ID,Provenience,Trendall ID,Image Number,Scene (A),Scene (A) Details,Instrument(s) & #,Performer(s),Performer Location(s),Performer Action(s),# of Figures,Composition of body,Scene (B),Scene (B) Details,Instrument(s) & #,Performer(s),Performer Location(s),Performer Actions,# of Figures,Composition,,,Publication,Number of Images,Instrument(s) A (including gender and dress),Instrument(s) B (including gender and dress),Figures A,Figures B,Other Attributes
,Apulian,,Krater,Column,,Athens 1680,,,,Athens,,1680.0,,09.109,1714,,"A woman dances L, looks R at upraised tambourine, a young satyr follows, also dancing, with wreath and sash-tied thyrsos",,,,,,,,"Two mantle figures face one another over a central stele, R with stick",,,,,,,,,,,,,,,
,Apulian,,Krater,Column,,Athens 1680,,,,Naples,Gerolomini,,,09.113,1719,,"A woman leans L, faces and looks R, strikes an upraised tambourine, a youth with long hair and drapery over arms moves L, holdings thyrsos and phiale",,,,,,,,"Two mantle figures face one another over a central stele, L with stick",,,,,,,,,,,,,,,
,Apulian,,Krater,Column,,Athens 1680,,,,New York,Parke-Benet,26.09.72 283,,09.114,1720-1,,"A woman sits facing R on a rock, upraised tambourine in L hand, a young satyr runs L carrying a wreath and a thyrsos",,,,,,,,"Two mantle figures face one another with sticks central, cross-circles in corners and square-thing in centre",,,,,,,,,,,,,,,
,Apulian,,Krater,Bell,,Athens 1680,,,,Taranto,,8109.0,Montescalgioso,09.116,1725,,"A woman with long dress moves L, looks R, raises up a ball and tambourine, then a young satyr with cross-body straps and thigh-let dances L, arms in front",,,,,,,,"Two mantle figures face one another, window to R",,,,,,,,,,,,,,,
,Apulian,,Krater,Bell,,Athens 1680,,,,Lecce,,780.0,,09.123,1726-9,,"(Some damage:) A woman moves R with a high-piled platter towards a youth, nude, seated facing L with kantharos and laurel branch, then a young satyr, frontal, leans L onto a stele, looks L, and holds an aulos (one pipe in each hand)",,,,,,,,"(Some damage:) three mantle figures, L gesturing R, stele, central facing L, R facing L",,,,,,,,,,,,,,,
,Apulian,,Krater,Bell,,Athens 1680,,,,Matera,,156619.0,,09.124,1730,,"A nude youth with animal skin bundled over L arm moves L carrying a torch, followed by a woman with dress exposing breasts, moving L, looking R at upraised tambourine",,,,,,,,"Two mantle figures face one another, L with stick",,,,,,,,,,,,,,,
,Apulian,,Krater,Bell,,Athens 1680,,,,Los Angeles,Private Collection,,,09.124a,1731-3,,"A woman with dress exposing breasts moves L, looks R at upraised tambourine, a young satyr follows, playing with ball and holding thyrsos",,,,,,,,"Two mantle figures face one another, R with stick, rosette between",,,,,,,,,,,,,,,
,Apulian,,Krater,Bell,,Athens 1680,,,,Naples,Private Collection,2-1-2,,09.124b,1734-5,,"A nude youth (satyr?) dances and gestures R, a woman moves R, looks L, beating upraised tambourine",,,,,,,,"Two mantle figures face one another, wreath central-middle",,,,,,,,,,,,,,,
,Apulian,,Pelike,,,Athens 1680,,,,New York,Christie's,11.07.90 174,,09.129a,1736-7,,"A woman with L leg raised holds a bunch of grapes and hands a wreath to an eros, facing L, with a tambourine in the central-middle",,,,,,,,"Two mantle figures face one another, L with stick",,,,,,,,,,,,,,,
,Apulian,,Pelike,,,Athens 1680,,,,Taranto,,,,09.130,1738,,"A woman leans L, faces and looks R, strikes an upraised tambourine, a youth with drapery over L arm moves L and extends a wreath in front of him",,,,,,,,“Two draped youths”,,,,,,,,,,,,,,,
,Apulian,,Pelike,,,Athens 1680,,,,New York,Sotheby's,05.07.82 416,,09.131,1739-40,,"A woman dances L, looks R at upraised tambourine, a youth with drapery over arms follows, extending wreath to L",,,,,,,,"Two mantle figures face one another, R with stick, stele in middle",,,,,,,,,,,,,,,
,Apulian,,Hydria,,,Athens 1680,,,,Leningrad,,531 (St. 1176),,09.138,1741,,,,,,,,,,,,,,,,,,,,,,,,,
,Apulian,,Hydria,,,Athens 1680,,,,Basel,H.A. Cahn Collection,96,,09.140a,1743,,"A woman dances L with ribbon and upraised tambourine, a youth with drapery over L arm follows with wreath extended to L",,,,,,,,,,,,,,,,,,,,,,,
,Apulian,,Krater,Bell,,Athens 1680,,,,Boston,Aleria,,,09.144,1748,,,,,,,,,,,,,,,,,,,,,,,,,
,Apulian,,Krater,Bell,,Altrock,,,,Munich,Altrock Collection,,,09.150,1752-3,,"A woman faces R with white oinochoe resting on shoulder and tambourine in lowered L hand, a youth faces L, leans on a stele with drapery on it, holding thyrsos and extending phiale to L, a young satyr with cross-body strap moves R, looks L, with torch",,,,,,,,"Three mantle figures, R two with sticks, central facing L",,,,,,,,,,,,,,,
,Apulian,,Hydria,,,Schlaepfer,,,,Lecce,,790,,09.163,1769,,"A nude youth with drapery over L arm faces R, carries a phiale/platter and extends a wreath to the R, a woman with long dress is seated facing L, radiate crown, upraised tambourine",,,,,,,,,,,,,,,,,,,,,,,
,Apulian,,Krater,Bell,,Schlaepfer,,,,"Cambridge, MA",Geddes MIT SIP,A 2:1,,09.169a,1774-8,,"A window above L, a woman with radiate crown faces R holding wreath and upraised tambourine, a nude youth with sandals seated on drapery facing L, with phiale/platter extended and thyrsos",,,,,,,,"Two mantle figures face one another, L with stick, R with wreath, box-thing above",,,,,,,,,,,,,,,
,Apulian,,Oinochoe,Shape 3,,Schlaepfer,,,,Taranto,,20424,,09.173,1783,,"A phlyax moves R with tambourine and mirror, a woman, seated on a rock, faces L with phiale",,,,,,,,,,,,,,,,,,,,,,,
,Apulian,,Oinochoe,Shape 3,,Schlaepfer,,,,Taranto,Ragusa Collection,123,,09.174,"4872, 1784",,A phlyax moves R with tambourine upraised,,,,,,,,,,,,,,,,,,,,,,,
,Apulian,,Krater,Bell,,Related to Schlaepfer,,,,Lecce,,773,,09.177,1785-6,,"A bearded, balding satyr sits facing R and plays the aulos, a goaty-legged satyr (Pan) with necklace dances with arms up facing L",,,,,,,,"Two mantle figures face one another, L with stick",,,,,,,,,,,,,,,
,Apulian,,Krater,Column,,Montpellier,,,,Montpellier,Musee Fabre,837-1-1116,,09.178,1787-8,,"A woman with dress and mantle over L arm faces R holding upraised wreath and upraised ta mbourine, a youth with drapery, two spears, and phiale/platter sits on a rock facing L, shield behind, another youth with drapery leans on raised R leg, holds wreath and sash",,,,,,,,"A mantle  figure with stick faces R, a woman facing R looks L with mirror and phiale, a mantle figure with stick faces L",,,,,,,,,,,,,,,
,Apulian,,Krater,Column,,Maplewood,,,,Vatican,,T 11 (18043),,09.192,1797-8,,"A youth in a short tunic with extra patterned 'bike-shorts' and mid-calf boots/sandals and long hair faces R playing a chelys lyre (L hand on strings, R with plectron) with a sash tied from the arm of the lyre to the L wrist, then a semi-draped youth with boots and long hair seated R with two spears, phiale, and a fantastic shield leaning against him (with a warrior in mediaeval-looking cuireass standing and facing L within a triangle-pattern edge), then a woman with long dress and drapery and long hair worn down facing L holding up wreath to the seated youth and a kalathos in her lowered L hand, then another youth with tunic, 'bike-shorts', crested helmet, two spears, and shield (decorated?) facing L",,,,,,,,"A mantle figure with stick faces R, then a woman with drapery over her arms faces R, tugs at her dress and holds out a phiale, then another mantle figure faces L, holding out a wreath, another wreath above",,,,,,,,,,,,,,,
,Apulian,,Krater,Column,,Maplewood,,,,Paris,Cabinet des Medailles,D 61,,09.193,1799-800,,"A woman with long dress and radiate crown dances R holding a thyrsos and upraised tambourine, an animal skin tied around her L arm, a nude youth with long hair and drapery over arms moves R, looks L, holds thyrsos and phiale, a young satyr moves R, looks L, holds torch and kalathos",,,,,,,,"Three mantle figures, L two with sticks, central facing L",,,,,,,,,,,,,,,
,Apulian,,Krater,Column,,Maplewood,,,,Edinburgh,,1956.461,,09.194,1802-3,,"A woman with long dress and drapery over arms faces R holding thyrsos and phiale, a nude youth with drapery sits facing L with thyrsos, extending wreath to L, tympanon resting in R corner below",,,,,,,,"Two mantle figures face one another, sticks central",,,,,,,,,,,,,,,
,Apulian,,Krater,Calyx,,Maplewood,,,,London,British Museum,F 274,,09.197,1805-6,,"A woman in short chiton with radiate crown and thin cross-body straps and boots walks L, looks R, picks up edge of chiton and holds torch, another woman in long, diaphanous drapery with thin cross-body straps and boots rides a spotted deer and holds two downward-pointing spears (Artemis?), followed by a young satyr with R hand over head and holding thyrsos moving L",,,,,,,,"woman with long dress and drapery over arms faces R with thyrsos and phiale, youth with drapery sits facing L with torch, tambourine below",,,,,,,,,,,,,,,
,Apulian,,Krater,Bell,,Maplewood,,,,Bari,Rizzon,6,,09.198a,1807,,"A youth with drapery over arms holds a thyrsos and looks down and R at a bell krater, with ribbed bottom and a single black figure (a satyr) moving/dancing R, over which a bunch of grapes on a vine hangs and into which a young satyr, facing L and holding a thyrsos, pours the contents of an amphora balanced on his L shoulder, then a woman in long dress dances R and looks L, beating an upraised tambourine",,,,,,,,"Three mantle figures, L with stick, central moving R and  gesturing/looking L",,,,,,,,,,,,,,,
,Apulian,,Dish,Knob-handled,,Maplewood,,"Inside, a woman's head facing L in the centre with a laurel branch, a vine in added white in a ring around",,New York,Market – Merin,,,09.201a,1814-5,,"A woman with drapery over arms faces R, holds thyrsos and extends wreath to R to an effeminate seated youth with long hair and radiate crown, seated facing L with phiale and thyrsos, then another youth with L foot up to R, facing frontal/R, looking L, holding tympanon and thyrsos",,,,,,,,"A young satyr carrying a torch moves L, looks R, a woman moves R, grabs at drapery, a youth with drapery over L arm follows carrying a wreath and stick",,,,,,,,,,,,,,,
,Apulian,,Pelike,,,Letet Group,,,,Bologna,,535,,09.211a,1825,,"A woman with semi-wrapped hair faces R holding a bunch of grapes and an upraised tambourine, a nude youth seated on drapery faces L with phiale extended to L",,,,,,,,Two mantle figures face one another,,,,,,,,,,,,,,,
,Apulian,,Krater,Column,,Letet Group,,,,Dallas,Curtis Brown,,,09.213a,1830-43,,"A young satyr moves R with phiale, a woman seated L looks R, tambourine on knee and holding a thyrsos to R, another youth with ivy in hair and drapery over arms faces L, holds thyrsos",,,,,,,,"Three mantle figures, L with stick, central with phiale facing L",,,,,,,,,,,,,,,
,Apulian,,Pelike,,,Verona,,,,Bari,Lagoia,,,09.224,1862-4,,"A woman with long dress moves L, looks R at upraised tambourine, carries a kalathos, a youth moves L with a kantharos extended to L and a stick behind",,,,,,,,"Two mantle figures face one another, R with stick",,,,,,,,,,,,,,,
,Apulian,,Krater,Bell,,Verona,,,,Bari,Cavalcanti,11,,09.226a,1866-7,,"A woman with long dress moves R carrying thyrsos and kalathos, a tambourine hangs centre-above, a youth sits on drapery facing L holding phiale to L and thyrsos to R",,,,,,,,"Two mantle figures face one another, L with stick, R gesturing L over a blood-stained stele",,,,,,,,,,,,,,,
,Apulian,,Krater,Bell,,Verona,,,,Bologna,,600,,09.230,1868-9,,"A young satyr faces R holding thyrsos and a platter/phiale in L hand, a woman moves L holding large tambourine with ribbons to L and thyrsos to R",,,,,,,,"Two mantle figures face one another over a central blood-stained tall-altar, L with wreath extended R, R extending hand over altar",,,,,,,,,,,,,,,
,Apulian,,Pelike,,,Connected to Verona,,,,Bari,Lagoia,,,09.244,DUPLICATION OF 09.224,,"A woman with long dress moves L, looks R at upraised tambourine, carries a kalathos, a youth moves L with a kantharos extended to L and a stick behind",,,,,,,,,,,,,,,,,,,,,,,
,Apulian,,Krater,Bell,,Rueff,,,,Scottsdale,Cutler,23,,09.249,1881-2,,"A woman with long dress faces R holding a horizontal thyrsos and an upraised tympanon, a double-blood-stained altar with flame (?) over which a nude youth, facing L with drapery and thyrsos, holds a kantharos, a young satyr with cross-body straps moves L carrying a kantharos and thyrsos",,,,,,,,"Three mantle figures, central facing and gesturing L",,,,,,,,,,,,,,,
,Apulian,,Krater,Column,,Rueff,,,,Kiel,,3284,,09.253,1891-2,,"A young satyr moves L, looks R carrying a thrsos and phiale with sprig in it, a youth with drapery over L shoulder moves L extending a kantharos and holding a thyrsos, a woman with long dress and radiate crown moves L holding a tambourine",,,,,,,,"Three mantle figures, centre facing L",,,,,,,,,,,,,,,
,Apulian,,Krater,Bell,,Connected to Rueff,,,,Vatican,,V 22 (18055),,09.264,1899,,"A window above L, a woman faces R with kalathos and cista, a young satyr faces L holding a tambourine and thyrsos",,,,,,,,"Two mantle figures face one another, sticks central, box-thing above",,,,,,,,,,,,,,,
,Apulian,,Krater,Bell,,Judgement,,,,Ruvo,,637,,10.22,1904-5,,"A woman sits R with kalathos, tambourine underneath in lower L corner, a nude youth with drapery over arms, frontal, gestures and looks L, thyrsos to R, a stele, a young satyr faces and gestures L, thyrsos to R",,,,,,,,"Three mantle figures, central facing L with stick",,,,,,,,,,,,,,,
,Apulian,,Krater,Bell,,Judgement,,,,New York,Sotheby's,14.12.81 349,,10.22a,1907-12,,"A woman in short chiton spins/dances facing frontal/R with arms clapping overhead, a woman with simple long dress faces R playing aulos, a torso-nude youth reclines L on a couch, elaborate headdress, holding a small branch/swatch and elaborate thyrsos, a three-footed, ridged bucket below",,,,,,,,"Three mantle figures, central facing L",,,,,,,,,,,,,,,
,Apulian,,Krater,Bell,,Judgement,,,,Ascona,Market – Galleria Casa Serodine,,,10.23,1913-8,,"A young eros faces R holding a kalathos and small thymiaterion, a torso- nude youth with fillet around head holds kantharos and thyrsos, sits L on the back of a lion with mane, looks R, a small fawn below, the lion himself moves R, rein held by a woman with long dress moving R, looking L, carrying tambourine in lowered L hand",,,,,,,,"A mantle figure faces R, a nude youth with drapery over L arm looks L with stick, a mantle figure faces L and extends a phi-wreath towards central figure",,,,,,,,,,,,,,,
,Apulian,,Krater,Calyx,,Judgement,,,,Cremona,Museo Civico (Dordoni),,,10.27a,1924-30,,"Figures inscribed: Hermes runs L, looks R, carrying a branch and child, a dog above, then Callisto, seated facing R on an animal skin with drapery exposing both breasts, holds a spear in her R hand, Lyssa, in elaborate dress with boots and fluttering cloak, moves R carrying two torches, looks down at Callisto to L, a fawn moving R below, then Artemis, holding bow in L hand, gestures and looks L, and Apollo, a nude youth with drapery and stick, rests his R elbow on Artemis's shoulder and looks L",,,,,,,,"Heavily damaged: a woman with long dress and palm frond faces R to a seated, torso-nude youth with long hair facing L, holding a thyrsos (?) and resting L elbow on a tambourine",,,,,,,,,,,,,,,
,Apulian,,Krater,Calyx,,Connected to Judgement,,,,Melbourne,Geddes Collection,A4:0,,10.40a,1945-54,,"A phlyax moves L carrying a wreath and a torch, a woman in long dress moves L holding upraised tambourine in her L hand, another phylax with mantle tied around waist and boots moves L playing the aulos",,,,,,,,"Three mantle figures, L with stick, centre facing L, R with strigil",,,,,,,,,,,,,,,
,Apulian,,Amphora,,,Connected to Judgement,,,,Copenhagen,Thorwaldsen,130,,10.41,1955-6,,"A nude youth with drapery over arms stands facing L, below and to R a woman, seated on a chair, faces L with an umprella, a tambourine hangs above, then a chest behind the seated woman and another woman, facing L and holding onto the legs of an eros, facing/flying L with a bird",,,,,,,,"A mantle figure leaning R on a stick looking R at a woman facing L holding a thyrsos, another mantle figure facing L",,,,,,,,,,,,,,,
,Apulian,,Amphora,,,Connected to Judgement,,,,Andover,Phillips Academy,177,,10.42,1959-61,,"A nude youth with drapery over L arm puts foot up on a low stele and faces R, a woman with long dress faces L holding thyrsos and upraised tambourine, tash tied around L wrist, a nude youth with drapery and stick faces L",,,,,,,,"Two mantle figures face one another, stele to lower L, tendril in centre, R figure with ball on a string",,,,,,,,,,,,,,,
,Apulian,,Krater,Column,,Group of Boston 00.348,,,,New York,,50.11.4,,10.47,1962-4,,"An ionic column stands to the L; lower L, a youth with curly hair and R leg up stirs/pokes at something in a bessel, above a torso-nude bearded figure sits L with scepter, looks R (Zeus); central, a larger-than-life statue of Herakes on a base, statue is white and frontal, club on a separate base, lion's skin draped over L arm and being painted/adorned by a bearded figure with pilos-cap, hunched L with a bowl in L hand and a stick-tool in R, below a small box, above a Nike seated R and looking L, and in the far R Herakles himself stands facing L, club in lowered L hand, lion's skin wrapped around shoulders with head as helmet, R fingers resting on lips",,,,,,,,"A young satyr with L leg raised hunches R and extends pan pipes to R, the a nude  youth sits L on drapery, looks R, a cap hanging at his shoulder and holding a kerykion (Hermes), below a small eros chases a duck/bird L, central Athena, seated R with aegis, wearing crested helmet above head, resting on shield and holding a spear, then a youth with boots, petasos, and two spears faces L and gestures L, a starburst over hand and a few branches below feet, then a tree with a couple of vine-y branches stands to the R",,,,,,,,,,,,,,,
,Apulian,,Krater,Bell,,Boston 00.348,,,,Boston,,00.348,,10.48,1965-6,,"A woman with long dress and animal-skin corset moves R carrying a thyrsos, a bearded, torso-nude figure with stick sits L and looks down and R, below a white-haired and bearded satyr with boots runs R chasing a small dog, also running R, then a woman with long dress and mantle sitting R on an aegis (Athena) plays the aulos (?!) and looks at a mirror held by a youth facing L and leaning on a stick with drapery, a tree growing behind he mirror, and in the far R a bearded satyr dances L",,,,,,,,"A bearded satyr dances L, looks R carrying a torch, a nude youth with drapery and stick moves L and looks R, a woman with long dress moves L, holds thyrsos in L arm, a bearded satyr faces R, holds thryrsos and plays with himself/prepares to urinate(?)",,,,,,,,,,,,,,,
,Apulian,,Krater,Bell,,Boston 00.348,,,,New York,Royal Athena Galleries,HNH 45,,10.48a,1968-74,,"A small statue of a female with bough (Artemis) stands underneath a small structure adorned with a garland, in front a woman with long dress, polos, and veil who moves R carrying a (massive) key and a small tablet (Iphigenia?) towards a youth (Pylades?) with petasos, boots, cloak, and two spears moving and gesturing L; underneath the youth (Orestes?), a medium dog sits facing R a seated youth with cloak, spear, and pilos hat seated facing L; upper R a woman on a biga pulled by two panthers rides L, below a youth carries a cat to a bird bath to the R",,,,,,,,"Above L a woman with long dress sits L, looks R, beats upraised tambourine, below L a calyx krater with a BF single figure running R into which a youth, moving L, dips an oinochoe; centre a torso-nude youth reclines L, looks R, holding a kylix on his finger and a thyrsos, a tripod  table below to which gestures a bearded silen seated facing L, and above the reclining youth a mask hangs in R-facing profile; R a bearded satyr with animal-skin drapery over arms moves L extending kantharos and carrying a thyrsos",,,,,,,,,,,,,,,
,Apulian,,Krater,Bell,,Boston 00.348,,,,Vatican,,T 2 (17941),,10.49,1975-7,,"“Scene from a tragedy” L-R: a column forms the L leg of a bench on which two women are seated, L figure facing R with a parasol, centre a woman stands in front facing R, R a woman with polos sits L and looks R, a boucranion above, then a column with a statue facing R on top, a pendentive semi-circle above the R ½ of the scene, where an old man wrapped up in a mantle and resting facing R on a stick gestures to a bearded man with elaborate short dress and boots and pilos and cloak facing L, holding a spear and gesturing with his R hand",,,,,,,,"A bearded satyr scampers L, looks R, carrying a torch and empty wineskin, a youth, frontal with drapery, moves L, looks R, holds a thyrsos, a woman with long dress moves L playing the aulos, a bearded satyr with boots moves L with upraised tambourine",,,,,,,,,,,,,,,
,Apulian,,Krater,Bell,,Boston 00.348,,,,Benevento,,,,10.49a,1978,,"Above, a torso-nude, bearded(?) figure (actor?) sits on an animal skin L, holds thyrsos, gestures to L and looks R, below a bearded satyr wearing boots moves L, looks and g estures R , a larger woman with short dress moves L, looks R, a tree with two vines grows in the centre, then a torso-nude youth with elaborate fillet sits on a chair L, gestures L and holds a thyrsos, then, above a block in the lower R, a woman moves L playing the aulos",,,,,,,,"A young satyr faces R holding a thyrsos and extending a cup to a torso-nude  youth, seated L on a panther skin and holding a thyrsos, a garland above and a blood-stained altar below, a woman with kalathos and tambourine moves L",,,,,,,,,,,,,,,
,Apulian,,Krater,Column,,Boston 00.348,,,,Jerusalem,Israel Museum,72.15.26,,10.51,1985-7,,"A bearded satyr stands frontal-L with tyhrsos, looks R, a mask hangs above, a nude youth sits R on drapery, holds kantharos and thyrsos, a small eros flies L with a wreath for the seated youth, a woman with long, patterned dress and short hair sits facing L with upraised tambourine over a calyx krater with a dancing black figure, another woman stands facing L, R hand raised, L holding a ribbed oinochoe",,,,,,,,"A bearded satyr sits L, looks R, a nude, frontal youth with drapery and thyrsos moves L, looks R, a woman with long dress moves L with tambourine",,,,,,,,,,,,,,,
,Apulian,,Krater,Bell,,Berkeley,,,,Amsterdam,Ancient Art,,,10.61,2004-5,,A young satyr with torch moves R following a woman with long-overfall dress moving R and beating upraised tambourine,,,,,,,,"Two mantle figures, R with chest bare and extending wreath to L over a tendril",,,,,,,,,,,,,,,
,Apulian,,Pelike,,,Comparable to Berkeley,,,,Palermo,Mormino,742,,10.68,2008,,"A female in short dress with jewellery around L leg does a backbend to the R, a tambourine hangs above and a hoop rolls to the L",,,,,,,,"A woman in long dress and mantle moves R, looks L at upraised ball",,,,,,,,,,,,,,,
,Apulian,,Oinochoe,Shape 5 (Olpe),,Comparable to Berkeley,,,,Bonn,,2666,,10.68a,2009-13,,"Continuous frieze, L-R: A Nike moves R herding a small ram (?) towards an ionic-scroll altar with an ionic column with sash tied around it behind, a woman with long dress and mantle moves L to altar with oinochoe extended, a young satyr moves R with thyrsos, [some loss,] another young satyr moves L (?) and looks R, holding a thyrsos, a woman with long dress moves L with ribbon hanging down from R hand and upraised tambourine in her L",,,,,,,,,,,,,,,,,,,,,,,
,Apulian,,Krater,Bell,,Dechter Painter,,,,Palermo,,1026,,10.84,2038,,"A torso-nude youth seated on a chair facing R with thyrsos gestures to R, a tambourine hangs aboe, a bearded satyr with phiale (?) and oinochoe walks L, a bell krater with two black figures in silhouette behind (and a wreath hanging in the upper R corner)",,,,,,,,"Two mantle figures face one another, R with stick, jumping weights above and central",,,,,,,,,,,,,,,
,Apulian,,Krater,Bell,,Related to Dechter,,,,Vatican,,V 7 (18035),,10.86,2041-3,,"A young satyr faces R holding an oinochoe and holding high a tambourine, on a couch a woman with long dress sits L on a cushion and holds two pipes of an aulos, looks R, a kalathos above, and then a torso-nude youth also reclines L, holding out a kantharos and holding a narthex, a skyphos hangs above",,,,,,,,"A woman with long dress and drapery moves L, looks R and holds a kalathos ad a torch (?), a nude youth with drapery over arms moves L, another woman with long dress and mantle follows",,,,,,,,,,,,,,,
,Apulian,,Pelike,Shape 3,,Thyrsus,,,,Foggia,,208,,10.123,2045,,"A youth with drapery over arms runs L, looks R, holds  thyrsos, a woman with long dress moves L, upraised tympanon in L hand, prepares to beat it with R, a bearded satyr with drapery over arms moves L with torch",,,,,,,,,,,,,,,,,,,,,,,
,Apulian,,Dish,,,Near the Thyrsus,,,,London,British Museum,F 133,,10.190,2046,,"A woman in long dress with branch held overhead moves R, a thyrsos with sash tied to it and a tambourine stand next to a tree trunk, another woman with long dress and animal-skin corset and boots moves L, looks R, wields a thyrsos like a spear, another woman with animal-skin corse moves L with thyrsos with sash overhead and tympanon held in lowered L hand",,,,,,,,"A calyx krater stands on a rock (table?), in front a young satyr moves R with hands up (dances?), then a youth with bare torso (ID'd as a woman by ADT) lies on stomach/side facing R on a panther skin, drapery over lower body, wreath in hair, and playing the aulos, a tambourine hangs overhead and a kantharos, phiale, and ball of something are below, then a nude woman with drapery over arms dances/turns R",,,,,,,,,,,,,,,
,Apulian,,Krater,Bell,,Near the Thyrsus,,,,Zurich,,2647,,10.201a,2048,,A woman with long dress moves L with upraised tambourine,,,,,,,,An eros moves L with upraised tambourine,,,,,,,,,,,,,,,
